,num,b,s,o,start_tfs,start_tfs_zulu,end_tfs_zulu,batter,stand,b_height,pitcher,p_throws,des,des_es,event_num,event,event_es,play_guid,home_team_runs,away_team_runs,inning,score
6,7,2,0,1,172941,2018-03-29T17:29:41Z,2018-03-29T17:32:49Z,452678,L,6-0,593372,R,"Asdrubal Cabrera reaches on a force attempt, throwing error by first baseman Jose Martinez.   Brandon Nimmo scores.    Jay Bruce to 2nd.  ","Asdrubal Cabrera se embasa en intento de out forzado, error en tiro de primera base Jose Martinez.   Brandon Nimmo anota  Jay Bruce a 2da.  ",53,Field Error,Error de Fildeo,4462527b-12e5-42ba-a9a0-c526344c90a0,1,0,1,T
7,8,0,1,3,173301,2018-03-29T17:33:01Z,2018-03-29T17:33:49Z,453943,R,6-3,593372,R,"Todd Frazier grounds into a double play, third baseman Matt Carpenter to second baseman Kolten Wong to first baseman Jose Martinez.   Asdrubal Cabrera out at 2nd.  ","Todd Frazier batea rodado batea para doble matanza, tercera base Matt Carpenter a segunda base Kolten Wong a primera base Jose Martinez.   Asdrubal Cabrera a cabo a 2da.  ",59,Grounded Into DP,Roletazo de Doble Play,189656d2-2f99-4945-8fdc-b216b38dd5f6,1,0,1,
8,9,1,3,1,173554,2018-03-29T17:35:54Z,2018-03-29T17:37:06Z,542303,R,6-1,592789,R,Marcell Ozuna called out on strikes.  ,Marcell Ozuna se poncha sin tirarle.  ,68,Strikeout,Ponche,ce975efb-8e6e-4bf5-b677-d25e9d9f9a22,1,0,2,
9,10,2,0,1,173717,2018-03-29T17:37:17Z,2018-03-29T17:38:22Z,500874,R,6-6,592789,R,Jose Martinez singles on a ground ball to left fielder Yoenis Cespedes.  ,Jose Martinez pega sencillo con rodado a jardinero izquierdo Yoenis Cespedes.  ,74,Single,Sencillo,0f8ed4e1-628e-4339-a29f-192d2bbdc324,1,0,2,
10,11,1,0,1,173837,2018-03-29T17:38:37Z,2018-03-29T17:39:52Z,425877,R,5-11,592789,R,Yadier Molina homers (1) on a fly ball to left field.   Jose Martinez scores.  ,Yadier Molina batea jonrón (1) con elevado por el jardín izquierdo.   Jose Martinez anota .  ,83,Home Run,Jonrón,513823f5-fcd3-43d4-b1a5-515ca769a77e,1,2,2,T
11,12,2,3,2,174010,2018-03-29T17:40:10Z,2018-03-29T17:41:34Z,657557,R,6-0,592789,R,Paul DeJong strikes out swinging.  ,Paul DeJong se poncha tirándole.  ,91,Strikeout,Ponche,df8c2d72-7f57-4506-8b93-2f6660274b8e,1,2,2,
12,13,1,3,3,174144,2018-03-29T17:41:44Z,2018-03-29T17:43:18Z,543939,L,5-9,592789,R,Kolten Wong called out on strikes.  ,Kolten Wong se poncha sin tirarle.  ,99,Strikeout,Ponche,34db8d01-a4c1-427c-bba9-3543bb7d408c,1,2,2,
13,14,0,1,1,174552,2018-03-29T17:45:52Z,2018-03-29T17:46:22Z,408236,L,6-2,593372,R,Adrian Gonzalez lines out to third baseman Matt Carpenter.  ,Adrian Gonzalez batea línea de out a tercera base Matt Carpenter.  ,105,Lineout,Línea de Out,0187575c-0c6a-489c-82ab-c338b4a656aa,1,2,2,
14,15,4,2,1,174638,2018-03-29T17:46:38Z,2018-03-29T17:48:47Z,608700,R,6-2,593372,R,Kevin Plawecki walks.  ,Kevin Plawecki recibe base por bolas.  ,115,Walk,Base por Bolas,3f55720a-1367-464d-b053-19c5f2c852c1,1,2,2,
15,16,1,3,2,174857,2018-03-29T17:48:57Z,2018-03-29T17:50:44Z,592789,L,6-6,593372,R,Noah Syndergaard called out on strikes.  ,Noah Syndergaard se poncha sin tirarle.  ,122,Strikeout,Ponche,60ea2c3c-61c9-43bd-a9ee-32df5d1445f7,1,2,2,
16,17,0,1,2,175054,2018-03-29T17:50:54Z,2018-03-29T17:51:49Z,642708,R,6-2,593372,R,Amed Rosario singles on a ground ball to center fielder Tommy Pham.   Kevin Plawecki to 2nd.  ,Amed Rosario pega sencillo con rodado a jardinero central Tommy Pham.   Kevin Plawecki a 2da.  ,128,Single,Sencillo,4bbb4dc4-a505-4c4e-b21a-5e7f27bb17c4,1,2,2,
17,18,4,2,2,175202,2018-03-29T17:52:02Z,2018-03-29T17:55:10Z,607043,L,6-3,593372,R,Brandon Nimmo walks.   Kevin Plawecki to 3rd.    Amed Rosario to 2nd.  ,Brandon Nimmo recibe base por bolas.   Kevin Plawecki a 3ra.    Amed Rosario a 2da.  ,140,Walk,Base por Bolas,88b9e027-8803-4d57-9369-bb2a3d866a88,1,2,2,
18,19,0,2,2,175534,2018-03-29T17:55:34Z,2018-03-29T17:57:01Z,493316,R,5-10,593372,R,Yoenis Cespedes singles on a line drive to left fielder Marcell Ozuna.   Kevin Plawecki scores.    Amed Rosario scores.    Brandon Nimmo to 2nd.  ,Yoenis Cespedes pega sencillo con línea a jardinero izquierdo Marcell Ozuna.   Kevin Plawecki anota  Amed Rosario anota  Brandon Nimmo a 2da.  ,152,Single,Sencillo,3836145e-2c13-441d-b968-c9cdec00a206,3,2,2,T
19,20,4,2,2,175716,2018-03-29T17:57:16Z,2018-03-29T18:01:53Z,457803,L,6-3,593372,R,Jay Bruce walks.   Brandon Nimmo to 3rd.    Yoenis Cespedes to 2nd.  ,Jay Bruce recibe base por bolas.   Brandon Nimmo a 3ra.    Yoenis Cespedes a 2da.  ,166,Walk,Base por Bolas,4178d82f-f8fc-4fc7-80da-c6670fb8e087,3,2,2,
20,21,0,3,3,180248,2018-03-29T18:02:48Z,2018-03-29T18:04:29Z,452678,L,6-0,593372,R,Asdrubal Cabrera strikes out swinging.  ,Asdrubal Cabrera se poncha tirándole.  ,174,Strikeout,Ponche,b2d492bf-6532-4f34-b835-aa2c34282759,3,2,2,
21,22,2,3,1,180652,2018-03-29T18:06:52Z,2018-03-29T18:08:27Z,593372,R,6-0,592789,R,Carlos Martinez called out on strikes.  ,Carlos Martinez se poncha sin tirarle.  ,185,Strikeout,Ponche,6b04e9d5-8988-4df5-9a8d-09d1219e1ff5,3,2,3,
22,23,1,3,2,180842,2018-03-29T18:08:42Z,2018-03-29T18:10:14Z,451594,L,6-5,592789,R,Dexter Fowler strikes out swinging.  ,Dexter Fowler se poncha tirándole.  ,192,Strikeout,Ponche,b3272014-0e5a-43c6-a363-7c9d4c059ce6,3,2,3,
23,24,1,3,3,181022,2018-03-29T18:10:22Z,2018-03-29T18:11:57Z,502054,R,6-1,592789,R,Tommy Pham strikes out swinging.  ,Tommy Pham se poncha tirándole.  ,200,Strikeout,Ponche,3a4a2760-ca3c-489d-80b5-1df01be82270,3,2,3,
24,25,0,0,1,181403,2018-03-29T18:14:03Z,2018-03-29T18:14:26Z,453943,R,6-3,593372,R,"Todd Frazier grounds out, third baseman Matt Carpenter to first baseman Jose Martinez.  ","Todd Frazier batea rodado de out, tercera base Matt Carpenter a primera base Jose Martinez.  ",205,Groundout,Roletazo de Out,2c6e9303-7f57-4c5e-8593-a8e346aafbb6,3,2,3,
25,26,4,0,1,181439,2018-03-29T18:14:39Z,2018-03-29T18:15:41Z,408236,L,6-2,593372,R,Adrian Gonzalez walks.  ,Adrian Gonzalez recibe base por bolas.  ,212,Walk,Base por Bolas,dfcb31e5-47c9-414f-a4e0-1524afec68ec,3,2,3,
26,27,0,0,1,181601,2018-03-29T18:16:01Z,2018-03-29T18:16:35Z,608700,R,6-2,593372,R,Kevin Plawecki doubles (1) on a sharp ground ball to left fielder Marcell Ozuna.   Adrian Gonzalez to 3rd.  ,Kevin Plawecki pega doble (1) con rodado fuerte a jardinero izquierdo Marcell Ozuna.   Adrian Gonzalez a 3ra.  ,217,Double,Doble,89edd359-752b-47b2-a661-3877bf3733d2,3,2,3,
27,28,2,3,2,181702,2018-03-29T18:17:02Z,2018-03-29T18:18:19Z,592789,L,6-6,593372,R,Noah Syndergaard called out on strikes.  ,Noah Syndergaard se poncha sin tirarle.  ,225,Strikeout,Ponche,db12bbfa-4183-4f87-961b-d3e6d6c19878,3,2,3,
28,29,0,1,3,181837,2018-03-29T18:18:37Z,2018-03-29T18:19:12Z,642708,R,6-2,593372,R,"Amed Rosario grounds out, shortstop Paul DeJong to first baseman Jose Martinez.  ","Amed Rosario batea rodado de out, campo corto Paul DeJong a primera base Jose Martinez.  ",230,Groundout,Roletazo de Out,7416b4a7-8349-4360-beab-c63bbbe8056f,3,2,3,
29,30,3,2,0,182138,2018-03-29T18:21:38Z,2018-03-29T18:23:51Z,572761,L,6-3,592789,R,Matt Carpenter doubles (1) on a line drive to right fielder Jay Bruce.  ,Matt Carpenter pega doble (1) con línea a jardinero derecho Jay Bruce.  ,241,Double,Doble,a82cc17c-f140-4f9e-834f-cc6d147edd4a,3,2,4,
30,31,1,3,1,182402,2018-03-29T18:24:02Z,2018-03-29T18:25:42Z,542303,R,6-1,592789,R,Marcell Ozuna strikes out swinging.  ,Marcell Ozuna se poncha tirándole.  ,248,Strikeout,Ponche,7951f8a5-e3bb-41fd-bea3-9b97676a8a5e,3,2,4,
31,32,1,0,1,182555,2018-03-29T18:25:55Z,2018-03-29T18:26:57Z,500874,R,6-6,592789,R,Jose Martinez singles on a line drive to center fielder Brandon Nimmo.   Matt Carpenter scores.  ,Jose Martinez pega sencillo con línea a jardinero central Brandon Nimmo.   Matt Carpenter anota.  ,255,Single,Sencillo,e4fbbc6a-29fe-45f9-8c78-faa5bb15fcb5,3,3,4,T
32,33,0,2,2,182710,2018-03-29T18:27:10Z,2018-03-29T18:28:49Z,425877,R,5-11,592789,R,Yadier Molina flies out to right fielder Jay Bruce.  ,Yadier Molina batea elevado de out a jardinero derecho Jay Bruce.  ,262,Flyout,Elevado de Out,80efe0b8-4b74-4bb0-a23d-18f4d7f99e72,3,3,4,
33,34,1,0,2,182856,2018-03-29T18:28:56Z,2018-03-29T18:29:50Z,657557,R,6-0,592789,R,Paul DeJong singles on a ground ball to center fielder Brandon Nimmo.   Jose Martinez to 3rd.  ,Paul DeJong pega sencillo con rodado a jardinero central Brandon Nimmo.   Jose Martinez a 3ra.  ,269,Single,Sencillo,ae277036-7441-455c-b143-57bdd009a9d6,3,3,4,
34,35,1,1,3,183003,2018-03-29T18:30:03Z,2018-03-29T18:31:15Z,543939,L,5-9,592789,R,"Kolten Wong grounds out, pitcher Noah Syndergaard to first baseman Adrian Gonzalez.  ","Kolten Wong batea rodado de out, lanzador Noah Syndergaard a primera base Adrian Gonzalez.  ",275,Groundout,Roletazo de Out,ab58c04d-f99d-4a53-a878-a8fbbff98ecb,3,3,4,
35,36,0,0,1,183327,2018-03-29T18:33:27Z,2018-03-29T18:33:50Z,607043,L,6-3,593372,R,Brandon Nimmo lines out sharply to center fielder Tommy Pham.  ,Brandon Nimmo batea línea de out fuertemente a jardinero central Tommy Pham.  ,281,Lineout,Línea de Out,8ec2e7d8-60d3-4d12-a274-d4a0547181fb,3,3,4,
36,37,0,3,2,183405,2018-03-29T18:34:05Z,2018-03-29T18:36:01Z,493316,R,5-10,593372,R,Yoenis Cespedes strikes out swinging.  ,Yoenis Cespedes se poncha tirándole.  ,289,Strikeout,Ponche,414c6e79-907f-476d-85c8-8e7919659e9d,3,3,4,
37,38,1,1,3,183612,2018-03-29T18:36:12Z,2018-03-29T18:37:14Z,457803,L,6-3,593372,R,Jay Bruce flies out sharply to left fielder Marcell Ozuna.  ,Jay Bruce batea elevado de out fuertemente a jardinero izquierdo Marcell Ozuna.  ,295,Flyout,Elevado de Out,38d248b5-919b-46cf-aa42-09cc8728c559,3,3,4,
38,39,1,3,1,183916,2018-03-29T18:39:16Z,2018-03-29T18:40:45Z,593372,R,6-0,592789,R,Carlos Martinez strikes out swinging.  ,Carlos Martinez se poncha tirándole.  ,303,Strikeout,Ponche,04085a7c-9816-42e8-aab3-ea60204093a2,3,3,5,
39,40,1,1,2,184058,2018-03-29T18:40:58Z,2018-03-29T18:42:06Z,451594,L,6-5,592789,R,Dexter Fowler lines out to center fielder Brandon Nimmo.  ,Dexter Fowler batea línea de out a jardinero central Brandon Nimmo.  ,309,Lineout,Línea de Out,f048d714-4a6f-4acc-959e-40c3da07a2d4,3,3,5,
40,41,3,3,3,184211,2018-03-29T18:42:11Z,2018-03-29T18:44:31Z,502054,R,6-1,592789,R,Tommy Pham strikes out swinging.  ,Tommy Pham se poncha tirándole.  ,319,Strikeout,Ponche,2ccfda5e-aa78-421d-97ec-1a3c686f919a,3,3,5,
41,42,1,0,1,184649,2018-03-29T18:46:49Z,2018-03-29T18:47:27Z,452678,L,6-0,593372,R,Asdrubal Cabrera flies out to left fielder Marcell Ozuna.  ,Asdrubal Cabrera batea elevado de out a jardinero izquierdo Marcell Ozuna.  ,325,Flyout,Elevado de Out,8eea0be8-479c-492d-ae73-945fba6cf910,3,3,5,
42,43,4,2,1,184748,2018-03-29T18:47:48Z,2018-03-29T18:49:11Z,453943,R,6-3,593372,R,Todd Frazier walks.  ,Todd Frazier recibe base por bolas.  ,334,Walk,Base por Bolas,c4ad0a0b-06a6-4d16-ab91-ae6324405946,3,3,5,
43,44,0,1,1,184927,2018-03-29T18:49:27Z,2018-03-29T18:51:38Z,408236,L,6-2,593372,R,Adrian Gonzalez doubles (1) on a line drive to right fielder Dexter Fowler.   Todd Frazier scores.  ,Adrian Gonzalez pega doble (1) con línea a jardinero derecho Dexter Fowler.   Todd Frazier anota.  ,344,Double,Doble,ed37bd09-e1c4-4914-985d-521daf841bd8,4,3,5,T
44,45,4,2,1,185425,2018-03-29T18:54:25Z,2018-03-29T18:56:56Z,608700,R,6-2,621199,R,Kevin Plawecki walks.  ,Kevin Plawecki recibe base por bolas.  ,356,Walk,Base por Bolas,28648bce-134c-4b24-ada6-e3a506655011,4,3,5,
45,46,0,0,2,185709,2018-03-29T18:57:09Z,2018-03-29T18:57:43Z,592789,L,6-6,621199,R,"Noah Syndergaard out on a sacrifice bunt, pitcher Matt Bowman to second baseman Kolten Wong.   Adrian Gonzalez to 3rd.    Kevin Plawecki to 2nd.  ","Noah Syndergaard out en toque de sacrificio, lanzador Matt Bowman a segunda base Kolten Wong.   Adrian Gonzalez a 3ra.    Kevin Plawecki a 2da.  ",362,Sac Bunt,Toque de Sacrificio,b3ab0d37-4e65-4b22-bfc0-4bdedf00f0d8,4,3,5,
46,47,0,0,2,185756,2018-03-29T18:57:56Z,2018-03-29T18:58:39Z,642708,R,6-2,621199,R,Amed Rosario singles on a line drive to left fielder Marcell Ozuna.   Adrian Gonzalez scores.    Kevin Plawecki scores.  ,Amed Rosario pega sencillo con línea a jardinero izquierdo Marcell Ozuna.   Adrian Gonzalez anota  Kevin Plawecki anota.  ,370,Single,Sencillo,afac6afa-92db-45bf-b0a1-9687b582ec39,6,3,5,T
47,48,2,1,2,185850,2018-03-29T18:58:50Z,2018-03-29T19:01:03Z,607043,L,6-3,621199,R,Brandon Nimmo singles on a line drive to left fielder Marcell Ozuna.   Amed Rosario to 2nd.  ,Brandon Nimmo pega sencillo con línea a jardinero izquierdo Marcell Ozuna.   Amed Rosario a 2da.  ,379,Single,Sencillo,9b26fc2d-c3be-44e2-a452-789f9ed9f2fe,6,3,5,
48,49,0,2,2,190217,2018-03-29T19:02:17Z,2018-03-29T19:03:58Z,493316,R,5-10,621199,R,Yoenis Cespedes singles on a line drive to left fielder Marcell Ozuna.   Amed Rosario scores.    Brandon Nimmo to 2nd.  ,Yoenis Cespedes pega sencillo con línea a jardinero izquierdo Marcell Ozuna.   Amed Rosario anota  Brandon Nimmo a 2da.  ,391,Single,Sencillo,bd088262-6f51-4ba2-9004-aa30e35a3888,7,3,5,T
49,50,2,2,2,190646,2018-03-29T19:06:46Z,2018-03-29T19:08:47Z,457803,L,6-3,446399,L,Jay Bruce singles on a ground ball to right fielder Dexter Fowler.   Brandon Nimmo scores.    Yoenis Cespedes to 3rd.  ,Jay Bruce pega sencillo con rodado a jardinero derecho Dexter Fowler.   Brandon Nimmo anota  Yoenis Cespedes a 3ra.  ,407,Single,Sencillo,c1d748f8-b925-4d11-9782-afc6c883ef50,8,3,5,T
50,51,3,1,3,190857,2018-03-29T19:08:57Z,2018-03-29T19:11:29Z,452678,R,6-0,446399,L,Asdrubal Cabrera pops out to catcher Yadier Molina in foul territory.  ,Asdrubal Cabrera batea elevadito de out a receptor Yadier Molina en territorio de foul.  ,418,Pop Out,Elevado de Out,71d27ea4-321f-401a-89e7-d273b0ea96af,8,3,5,
51,52,0,1,1,191325,2018-03-29T19:13:25Z,2018-03-29T19:14:12Z,572761,L,6-3,592789,R,Matt Carpenter flies out to left fielder Yoenis Cespedes.  ,Matt Carpenter batea elevado de out a jardinero izquierdo Yoenis Cespedes.  ,425,Flyout,Elevado de Out,a5d1ed3c-785a-4938-9c8a-abd768d8b192,8,3,6,
52,53,2,2,2,191420,2018-03-29T19:14:20Z,2018-03-29T19:16:31Z,542303,R,6-1,592789,R,"Marcell Ozuna grounds out, shortstop Amed Rosario to first baseman Adrian Gonzalez.  ","Marcell Ozuna batea rodado de out, campo corto Amed Rosario a primera base Adrian Gonzalez.  ",433,Groundout,Roletazo de Out,162afaf1-8c34-4788-8bdc-99bcfb8a5512,8,3,6,
53,54,0,1,2,191641,2018-03-29T19:16:41Z,2018-03-29T19:17:41Z,500874,R,6-6,592789,R,Jose Martinez homers (1) on a fly ball to left center field.  ,Jose Martinez batea jonrón (1) con elevado entre los jardines izquierdo y central.  ,439,Home Run,Jonrón,9ca193c7-9aa3-482b-8d69-3e97d227bd66,8,4,6,T
54,55,0,0,3,191801,2018-03-29T19:18:01Z,2018-03-29T19:18:27Z,425877,R,5-11,592789,R,Yadier Molina pops out to shortstop Amed Rosario.  ,Yadier Molina batea elevadito de out a campo corto Amed Rosario.  ,443,Pop Out,Elevado de Out,4c1d0e25-3364-4dd2-8b4a-11d128ac6321,8,4,6,
55,56,2,2,0,192059,2018-03-29T19:20:59Z,2018-03-29T19:22:46Z,453943,R,6-3,594577,R,Todd Frazier singles on a line drive to left fielder Marcell Ozuna.  ,Todd Frazier pega sencillo con línea a jardinero izquierdo Marcell Ozuna.  ,454,Single,Sencillo,36d2a068-3f6e-48ff-87bb-c335bb4a32ec,8,4,6,
56,57,0,1,0,192256,2018-03-29T19:22:56Z,2018-03-29T19:23:47Z,408236,L,6-2,594577,R,Adrian Gonzalez singles on a sharp line drive to right fielder Dexter Fowler.   Todd Frazier to 2nd.  ,Adrian Gonzalez pega sencillo con línea fuerte a jardinero derecho Dexter Fowler.   Todd Frazier a 2da.  ,460,Single,Sencillo,07100609-6d1b-4b08-b084-61044a3511ca,8,4,6,
57,58,1,2,1,192405,2018-03-29T19:24:05Z,2018-03-29T19:27:26Z,608700,R,6-2,594577,R,Kevin Plawecki lines out to left fielder Marcell Ozuna.  ,Kevin Plawecki batea línea de out a jardinero izquierdo Marcell Ozuna.  ,470,Lineout,Línea de Out,f4587bfc-6233-47bb-83d5-4c3b732a3582,8,4,6,
58,59,1,2,2,192752,2018-03-29T19:27:52Z,2018-03-29T19:29:36Z,527038,R,6-3,594577,R,Wilmer Flores pops out to first baseman Jose Martinez on the infield fly rule.  ,Wilmer Flores batea elevadito de out a primera base Jose Martinez en jugada de infield fly.  ,479,Pop Out,Elevado de Out,69dbcf2a-15d5-457b-9154-d76f8a08e536,8,4,6,
59,60,0,3,3,192953,2018-03-29T19:29:53Z,2018-03-29T19:31:09Z,642708,R,6-2,594577,R,Amed Rosario strikes out swinging.  ,Amed Rosario se poncha tirándole.  ,485,Strikeout,Ponche,87a25adc-536a-4b42-8094-21f47f01b8fc,8,4,6,
60,61,2,3,1,193347,2018-03-29T19:33:47Z,2018-03-29T19:35:07Z,657557,R,6-0,607229,R,Paul DeJong strikes out swinging.  ,Paul DeJong se poncha tirándole.  ,497,Strikeout,Ponche,ee10dc2f-8b0e-4033-826e-8a9eedf536d7,8,4,7,
61,62,2,3,2,193525,2018-03-29T19:35:25Z,2018-03-29T19:37:05Z,543939,L,5-9,607229,R,Kolten Wong called out on strikes.  ,Kolten Wong se poncha sin tirarle.  ,505,Strikeout,Ponche,ad84fa18-3542-47d9-9f06-e71be7a0e071,8,4,7,
62,63,1,3,3,193742,2018-03-29T19:37:42Z,2018-03-29T19:38:48Z,622168,R,6-1,607229,R,Yairo Munoz strikes out swinging.  ,Yairo Munoz se poncha tirándole.  ,514,Strikeout,Ponche,8b41bd03-f52a-45c9-b841-ed4cd4de7799,8,4,7,
63,64,1,1,0,194226,2018-03-29T19:42:26Z,2018-03-29T19:43:26Z,607043,L,6-3,663855,R,Brandon Nimmo singles on a ground ball to shortstop Paul DeJong.  ,Brandon Nimmo pega sencillo con rodado a campo corto Paul DeJong.  ,523,Single,Sencillo,58174597-8c2d-4482-a0db-089c2f5320f7,8,4,7,
64,65,0,0,2,194340,2018-03-29T19:43:40Z,2018-03-29T19:44:13Z,493316,R,5-10,663855,R,"Yoenis Cespedes grounds into a double play, shortstop Paul DeJong to second baseman Kolten Wong to first baseman Jose Martinez.   Brandon Nimmo out at 2nd.  ","Yoenis Cespedes batea rodado batea para doble matanza, campo corto Paul DeJong a segunda base Kolten Wong a primera base Jose Martinez.   Brandon Nimmo a cabo a 2da.  ",528,Grounded Into DP,Roletazo de Doble Play,2144b515-53bd-4211-86d1-ea27c8b131ff,8,4,7,
65,66,1,3,3,194435,2018-03-29T19:44:35Z,2018-03-29T19:45:45Z,457803,L,6-3,663855,R,Jay Bruce strikes out swinging.  ,Jay Bruce se poncha tirándole.  ,535,Strikeout,Ponche,3c6b41e5-0aee-4f47-8a4c-baca9a84c2eb,8,4,7,
66,67,1,2,1,194815,2018-03-29T19:48:15Z,2018-03-29T19:50:27Z,451594,L,6-5,461872,R,"Dexter Fowler grounds out, third baseman Todd Frazier to first baseman Adrian Gonzalez.  ","Dexter Fowler batea rodado de out, tercera base Todd Frazier a primera base Adrian Gonzalez.  ",546,Groundout,Roletazo de Out,3f9d2cb2-0cd2-4053-ae6b-f9a921a3590e,8,4,8,
67,68,2,3,2,195042,2018-03-29T19:50:42Z,2018-03-29T19:52:27Z,502054,R,6-1,461872,R,Tommy Pham strikes out swinging.  ,Tommy Pham se poncha tirándole.  ,554,Strikeout,Ponche,31c8b13c-e894-4505-acc7-40d14fd0379d,8,4,8,
68,69,0,2,3,195241,2018-03-29T19:52:41Z,2018-03-29T19:53:55Z,572761,L,6-3,461872,R,Matt Carpenter flies out to left fielder Yoenis Cespedes.  ,Matt Carpenter batea elevado de out a jardinero izquierdo Yoenis Cespedes.  ,560,Flyout,Elevado de Out,4954e6d1-c76a-42e3-ab4f-c267be8b21b2,8,4,8,
69,70,4,1,0,195629,2018-03-29T19:56:29Z,2018-03-29T19:58:16Z,452678,L,6-0,592815,R,Asdrubal Cabrera walks.  ,Asdrubal Cabrera recibe base por bolas.  ,571,Walk,Base por Bolas,ec89a677-7a90-4e15-a2df-92ee5c77f2b0,8,4,8,
70,71,1,3,1,195822,2018-03-29T19:58:22Z,2018-03-29T20:01:10Z,453943,R,6-3,592815,R,Todd Frazier strikes out swinging.  ,Todd Frazier se poncha tirándole.  ,580,Strikeout,Ponche,73fd4174-d37a-4e51-a3ec-fc9270f2ead1,8,4,8,
71,72,4,2,1,200121,2018-03-29T20:01:21Z,2018-03-29T20:04:54Z,408236,L,6-2,592815,R,Adrian Gonzalez walks.  ,Adrian Gonzalez recibe base por bolas.  ,595,Walk,Base por Bolas,24ed40ef-4b75-4406-ac06-55292c030aa2,8,4,8,
72,73,0,0,1,200507,2018-03-29T20:05:07Z,2018-03-29T20:05:43Z,608700,R,6-2,592815,R,Kevin Plawecki singles on a ground ball to left fielder Marcell Ozuna.   Asdrubal Cabrera scores.    Adrian Gonzalez to 2nd.  ,Kevin Plawecki pega sencillo con rodado a jardinero izquierdo Marcell Ozuna.   Asdrubal Cabrera anota  Adrian Gonzalez a 2da.  ,602,Single,Sencillo,d5ec11e2-d458-4f2c-b8ca-6b229934131c,9,4,8,T
73,74,1,1,3,200607,2018-03-29T20:06:07Z,2018-03-29T20:07:10Z,501571,R,6-1,592815,R,"Juan Lagares grounds into a double play, third baseman Matt Carpenter to second baseman Kolten Wong to first baseman Jose Martinez.   Kevin Plawecki out at 2nd.  ","Juan Lagares batea rodado batea para doble matanza, tercera base Matt Carpenter a segunda base Kolten Wong a primera base Jose Martinez.   Kevin Plawecki a cabo a 2da.  ",611,Grounded Into DP,Roletazo de Doble Play,93b90014-4847-4262-8374-1e226115444d,9,4,8,
74,75,2,3,1,200937,2018-03-29T20:09:37Z,2018-03-29T20:11:23Z,542303,R,6-1,544727,R,Marcell Ozuna strikes out swinging.  ,Marcell Ozuna se poncha tirándole.  ,623,Strikeout,Ponche,27746e7f-9ec0-403a-9f92-dc4b0fef5b01,9,4,9,
75,76,2,1,2,201135,2018-03-29T20:11:35Z,2018-03-29T20:13:16Z,500874,R,6-6,544727,R,Jose Martinez pops out to second baseman Asdrubal Cabrera.  ,Jose Martinez batea elevadito de out a segunda base Asdrubal Cabrera.  ,630,Pop Out,Elevado de Out,49684f1b-3000-4997-88fe-37640c176a41,9,4,9,
76,77,4,2,2,201326,2018-03-29T20:13:26Z,2018-03-29T20:16:00Z,425877,R,5-11,544727,R,Yadier Molina walks.  ,Yadier Molina recibe base por bolas.  ,639,Walk,Base por Bolas,11098859-b7c4-43de-b2b3-bae26ce1afa2,9,4,9,
77,78,1,0,3,201635,2018-03-29T20:16:35Z,2018-03-29T20:17:22Z,657557,R,6-0,544727,R,Paul DeJong lines out to second baseman Asdrubal Cabrera.  ,Paul DeJong batea línea de out a segunda base Asdrubal Cabrera.  ,648,Lineout,Línea de Out,cac1737e-03f4-4283-b643-1be8847c5726,9,4,9,
""
,num,b,s,o,start_tfs,start_tfs_zulu,end_tfs_zulu,batter,stand,b_height,pitcher,p_throws,des,des_es,event_num,event,event_es,play_guid,home_team_runs,away_team_runs,inning,score
0,1,1,3,1,200720,2018-03-29T20:07:20Z,2018-03-29T20:09:04Z,446359,R,6-0,608665,R,Zack Cozart strikes out swinging.  ,Zack Cozart se poncha tirándole.  ,9,Strikeout,Ponche,bb875f5c-3ebb-435a-9be6-11bf763cb600,0,0,1,
1,2,1,2,2,200919,2018-03-29T20:09:19Z,2018-03-29T20:10:34Z,545361,R,6-2,608665,R,"Mike Trout grounds out, shortstop Marcus Semien to first baseman Matt Olson.  ","Mike Trout batea rodado de out, campo corto Marcus Semien a primera base Matt Olson.  ",16,Groundout,Roletazo de Out,df1cdcac-ca38-41ad-a953-1f8cfa566ee6,0,0,1,
2,3,2,2,3,201043,2018-03-29T20:10:43Z,2018-03-29T20:12:20Z,457708,R,6-2,608665,R,Justin Upton pops out to first baseman Matt Olson in foul territory.  ,Justin Upton batea elevadito de out a primera base Matt Olson en territorio de foul.  ,24,Pop Out,Elevado de Out,6d44e3a3-f958-4dab-b169-1ca18daca2ea,0,0,1,
3,4,0,0,0,201422,2018-03-29T20:14:22Z,2018-03-29T20:15:19Z,459964,L,6-2,572070,R,Matt Joyce singles on a soft ground ball to pitcher Garrett Richards.  ,Matt Joyce pega sencillo con rodado suave a lanzador Garrett Richards.  ,29,Single,Sencillo,d344bdfe-a037-4bab-84aa-503a10b284cd,0,0,1,
4,5,1,0,0,201527,2018-03-29T20:15:27Z,2018-03-29T20:16:29Z,543760,R,6-0,572070,R,Marcus Semien singles on a line drive to center fielder Mike Trout.   Matt Joyce to 3rd.  ,Marcus Semien pega sencillo con línea a jardinero central Mike Trout.   Matt Joyce a 3ra.  ,36,Single,Sencillo,512b9193-27e9-4469-8919-f151d42b293c,0,0,1,
5,6,2,2,1,201637,2018-03-29T20:16:37Z,2018-03-29T20:20:01Z,476704,L,6-0,572070,R,"Jed Lowrie reaches on a fielder's choice out, first baseman Albert Pujols to catcher Martin Maldonado.   Matt Joyce out at home.    Marcus Semien to 2nd.  ","Jed Lowrie se embasa por out en jugada de selección, primera base Albert Pujols a receptor Martin Maldonado.   Matt Joyce a cabo a home.    Marcus Semien a 2da.  ",46,Fielders Choice Out,Out en Jugada de Selección,fa310039-159f-41e2-8a4a-8f59a73ab26a,0,0,1,
6,7,0,2,2,202008,2018-03-29T20:20:08Z,2018-03-29T20:23:04Z,501981,R,5-10,572070,R,Khris Davis flies out to right fielder Kole Calhoun.  ,Khris Davis batea elevado de out a jardinero derecho Kole Calhoun.  ,53,Flyout,Elevado de Out,e0f172d4-04d6-4fed-ba0b-23777ef26865,0,0,1,
7,8,3,3,3,202317,2018-03-29T20:23:17Z,2018-03-29T20:27:21Z,621566,L,6-5,572070,R,Matt Olson strikes out swinging.  ,Matt Olson se poncha tirándole.  ,62,Strikeout,Ponche,cf167f42-f5c3-49b1-85f2-ff7bd8b94363,0,0,1,
8,9,0,2,1,202907,2018-03-29T20:29:07Z,2018-03-29T20:30:14Z,405395,R,6-3,608665,R,Albert Pujols flies out to right fielder Stephen Piscotty.  ,Albert Pujols batea elevado de out a jardinero derecho Stephen Piscotty.  ,70,Flyout,Elevado de Out,6de64bb1-68bd-49eb-8ed9-6cdf343eda30,0,0,2,
9,10,1,2,1,203024,2018-03-29T20:30:24Z,2018-03-29T20:32:14Z,594777,L,5-10,608665,R,Kole Calhoun triples (1) on a sharp fly ball to center fielder Boog Powell.  ,Kole Calhoun pega triple (1) con elevado fuerte al jardinero central Boog Powell.  ,77,Triple,Triple,8b04d856-17ca-4983-885b-af20fb6603b0,0,0,2,
10,11,1,1,1,203217,2018-03-29T20:32:17Z,2018-03-29T20:34:22Z,592743,R,6-2,608665,R,Andrelton Simmons singles on a ground ball to center fielder Boog Powell.   Kole Calhoun scores.  ,Andrelton Simmons pega sencillo con rodado a jardinero central Boog Powell.   Kole Calhoun anota.  ,85,Single,Sencillo,3c9ee836-f791-4597-82ec-ddf9c1f09494,0,1,2,T
11,12,1,1,2,203430,2018-03-29T20:34:30Z,2018-03-29T20:36:32Z,472528,L,5-10,608665,R,Luis Valbuena pops out to third baseman Matt Chapman in foul territory.  ,Luis Valbuena batea elevadito de out a tercera base Matt Chapman en territorio de foul.  ,92,Pop Out,Elevado de Out,1a14094e-2bf2-4c4d-b7cb-865b2f68fb24,0,1,2,
12,13,0,0,2,203649,2018-03-29T20:36:49Z,2018-03-29T20:37:19Z,660271,L,6-4,608665,R,Shohei Ohtani singles on a ground ball to right fielder Stephen Piscotty.   Andrelton Simmons to 2nd.  ,Shohei Ohtani pega sencillo con rodado a jardinero derecho Stephen Piscotty.   Andrelton Simmons a 2da.  ,97,Single,Sencillo,b6c61ee6-2fb8-46b2-8fcf-937eed0bab13,0,1,2,
